{
  "schema_version": 1,
  "work_id": "71824e85-f192-43f3-9a68-a90a332fb1e0",
  "title": "Define user-authorized handling for Vince personally verified observations",
  "worker": {
    "kind": "chatgpt",
    "session_id": "1245ac6f-0e4c-43e8-b0cb-b0c73549347d"
  },
  "implementation_branch": "work/71824e85-f192-43f3-9a68-a90a332fb1e0",
  "base_sha": "8a11d81b3f8f2752a8f93e42f582b877e2ca3963",
  "component_id": "issue_21",
  "repo_paths": [
    "continuity/bootstrap.json",
    "continuity/checkpoints/CP-000001-0c214599.json",
    "continuity/checkpoints/CP-000002-b0cf7906.json",
    "continuity/checkpoints/CP-000003-92bfa7c4.json",
    "continuity/user-observations.jsonl",
    "governance/user-observation-policy.json",
    "governance/work-admissions.json",
    "scripts/evaluate_user_observation.py",
    "tests/test_user_observation.py",
    "tests/test_work_selection.py"
  ],
  "external_targets": [],
  "claims": [
    {
      "resource_key": "component:issue_21",
      "lock_branch": "lock/3193a55f9456d3ece2a30033010c4f6116751aad61410c06945be459de3227eb",
      "lease_id": "67607383-0d52-48a6-9eb7-e257018a8b56",
      "generation": 4
    }
  ],
  "runtime_control_authority": "NONE"
}
